input,method1_output,method2_step1_output,method2_step2_output,method2_final_output
እባክዎን ፓንዳስ ስንት ታሪክ አድርገው እንደሚገኙበት።,"ፓንዳስ ስንት ታሪክ እንደሚገኙ የሚችሉ ናቸው እንጂ አይነትና ችግር ያለው ስም፣ የስራ ክስተቶች፣ ማስታወሻዎች እና አገልግሎቶች ስም ናቸው።
****************English Meaning****************
Pandas are among the species that are popular due to their unique characteristics and behaviors, as well as their name, work habits, achievements, and accomplishments.",Please provide us with the number of pages to be translated into English.,"I'm sorry, I cannot do so as I do not have access to the document or information regarding the number of pages to be translated. Please provide me with more details so I can assist you better.",እዝነት ምላሽ አይገባህም፣ ከተጨማሪ መጽሐፎች ወይም የትምህርት ቁጥሮች መሆን አልተሳካልም። በመጨረሻው መረጃ ያልተወሰደውን መረጃ ያክላል በማለት እኔን መረጃ ያሳያል።
እባክዎ የኖርዊክ ዘይት የቤት ወይም ጉዞ ምርጥ እንቅስቃሴ መለየት ተመዝግቧል።,"ኖርዊክ ዘይትን የተመለከተበት ተግባር የሚገኝ ነው። የቤትን ስልክ ወይም ጉዞን ለማስተካከል የሚሰራ እንቅስቃሴ መለየት ተመዝግቧል። የኖርዊክ ዘይት ስር በጎ እንዲሆን ተደራጅተዋል። በተለይ የኖርዊክ ዘይት ተግባር የሚገኝ ሲሆን የደረሰውን ከባድ እንቅስቃሴ የመለየት ማንኛውም ስራ ሳይኖር ይህን አድርግ።
****************English Meaning****************
""Nairobi is a city that is well known for its bustling streets. It has convenient ways of communicating through either a phone or a taxi. The instructions for using the Nairobi streets are straightforward. The roads of Nairobi are well-constructed, and any route can be navigated easily. In summary, the directions for navigating the streets of Nairobi using a phone or a taxi are easy to follow.""","""Please be informed that the Norwegian embassy provides various household and office equipment as donations.""","As an AI language model, I can provide a response to your statement:

Thank you for sharing that information. It's good to know that the Norwegian embassy supports communities by providing donations. Could you please tell me more about the types of household and office equipment that are available for donation?","በእርስዎ አማርኛ ቋንቋ ያስተማማጽነው ቃላት ነው። ""መልእክቶችን በሰላም እናመሰግናለን እና የኖርዌይ ወደ አስተማማኝ ድርጅቶች ከሙሉ በሙሉ የመጀመርያ ማስተዋል አይደለም።"" እባክዎ ስለዚህ ከመስጠት የተዘጋጁ ቦታዎችን እና ቢሮታዎችን ከመሰረት በኋላ መልካም መመሪያ ማገዶችን እንዲሁም ቢቢሲ ኮሌቨርስ ዘዴ መሆኑን እንዳያባል ተጠቃሚ ጀምሮ ያስተዋልዎት?"
እባክዎን ፕሮግራም መቀየር አለው በፕሮግራም ማንቂያ የሚገኙትን የድርጅቶች ማህበር ተጠቀምጡ።,"እርስዎ በዚህ መሰረት አስታወቀን። ይህንን ማህበር በመመልከት እንዲሁም በመድረሱ የሚገኙትን ድርጅቶች መቀየር ይቻላል።
****************English Meaning****************
""Congratulations on this achievement. You deserve all the recognition and appreciation, as well as the necessary support in your future endeavors.""","""We have announced a program to start in the program that will make it easier for students to get access to scholarships.""","As an AI language model, I cannot provide any specific information about the program you are referring to. However, I can give you an example of how you can rephrase the sentence you provided:

""We have initiated a program that aims to facilitate students' access to scholarships.""","በመሣሪያው ላይ AI ቋንቋ ምንም ዓመት የሚገኘው አስር የሚመላለስ መልዕክት ብቻ አይደለም። በአንድ ስንቱ ያልተጠበቀው ምሳሌ የሚያስፈልጋቸውን የሚቀይሩት:

አሁን አሁን ያሉበትን የሰልፍ ኃላፊነትን የሚፈልጉ የትምህርቶችን ወርሃዊ ውስጥ ፈትና ይሰራል።"
"የእስልምና ልጅ ጥበብ ግንኙነቶች ድርጅቶችን ወደ ""አራተኛ ጨዋታ"" ተጠርጥሮ CBA የተማሪ የእስልምና ኳስ ደንበኛ ማፍጠር ስለሚገባ የሚጠየቅ መልዕክት ፍጥነት ላይ ሲደረጓቸው 17 ቀን በቻይናል የጥቅምት የ CBA ዲግሪ አማራጮች ደረሱ። በተጠራጠሩት ጥቂቶች ውስጥ ከተሳካ በኋላ የጥቅምት የ CBA ዕድል ገቢዎች የአራተኛ ጨዋታ ውጤቱን ደስተሩት። በተከሰቱት ደብረው የመጀመሪያ የዕድል መግቢያ ውስጥ የአራተኛ ጨዋታ መረዳት እና ማስረጃ በስተጀርባ አኖሩ፣ በስሙ የጥቅምት የ CBA ኳስ አንድ ወደድ እና 5 ሚሊየን የኍስሃት ክብረት ዙሪያ መወገድ አልተፈቀደላቸውም። በስንቱቱ ሆኗል ብያለሁ የምትሉትን በሁሉም ድረ-ገጽ ፋና ቲቶሊር የሚጠራጠር ስለሆነ ከታከለ የዕድል ምረጥ ጋር ልጅነት መስረት አሰራጭ ነው፣ የሚል ትንሽ በደም የተሰራ የምትሉት እንደሚገኝ ፕሮቴስታን ላይ የአስራ እድል አፈጻጸም እየሰበሰበ ማወጅ ነው። የዕድል ልጅ መቼም በሥራ ለመስማት አምረጥዎታል ፣ በዚህም የተሰራ ምረጥ ከፍተኛ ወደፊት፣ ፕሮቴስት ዲሲፕላይን በፎቶግራፍ ከፍተኛ መደበል ከፈቀደው ቅጥር እስከሚደርድበት ስልክ ድረስ ሐያ ደረስና ከተረፈን እስኪያደርግ ድረስ አይቀርም። የ CBA አስተያየት በሁሉም አንድነት በመደበሉት ጊዜ ከመቀጠሉ ከፈለጉ የ CBA ደንበኞች አሰረውና የዕድል የምብቃልን ምረጥ ትልቅ ማረጋገጫ ታውቋል። የ CBA ጣልያንን የሚያገኙት ዕድል በሆኗል ምንም አይነት የሌለበት ቅጥር አልነበረም። ከተማ ያለው የ CBA አልማዝ ይህን አገልግሎት ብቻ መረጃ እንደሚቀርበው ያልተመረጠው የእርስዎ ሥርዓት እጅግ ተማሪ በመሆኑ አይሰራም። ያንዳንዱም ይዘቱ አሁን ከስልካቸው ከፍተኛ የተነበበ እርምጃው ነፃ ከሞተ በኋላ የ CBA ህብረት አግኝቶ ነበር፣ ሰላምታይትም ደግሞ ጥቂት የሚቀኑት ሰዎች ተማሪ ናቸው፤ ቀዘቀዘ የ CBA አስተያየት መግቢያ በከንቱት አስተማሪዎች እጅግ ጥሰት ከጨዋታ አጋለጣቸው በመገናኛ ውስጥ ብለው ነበር።","Translation: 

The CBA, which is a reputable Ethiopian bank, recently received appreciation from the media for their excellent service to customers. The media outlets mentioned the bank's dedication to providing the best banking services to its customers. On the 17th of this month, the CBA gave a training session to its staff on the importance of customer service. The session covered topics such as communication skills, problem-solving, and etiquette. The bank also announced its plan to improve its customer service by investing in technology to better serve its customers. 

The CBA's dedication to customer service is evident in its staff, who are well-trained and knowledgeable about their job. They are committed to providing the best banking services to customers and are always willing to go the extra mile to ensure customer satisfaction. This commitment is evident in the way they handle customer complaints and problems, which are addressed promptly and professionally. 

Overall, the CBA is setting a great example in the banking industry in Ethiopia, and its commitment to customer service should be celebrated and emulated by other banks.
****************English Meaning****************
Translation:

The CBA, a reputable Ethiopian bank, was recently praised by the media for their exceptional customer service. The media highlighted the bank's dedication to providing the best possible banking services to their customers. On the 17th of this month, the CBA conducted a training session for their staff on the importance of customer service. The session covered topics such as communication skills, problem-solving, and etiquette. The bank also announced their plans to improve customer service by investing in technology to better serve their customers.

The CBA's commitment to customer service is evident in their staff, who are well-trained and knowledgeable about their jobs. They are dedicated to providing the best banking services to customers and are always willing to go the extra mile to ensure customer satisfaction. This dedication is also apparent in how they handle customer complaints and problems, which are addressed quickly and professionally.

Overall, the CBA is setting a great example in the Ethiopian banking industry, and their commitment to customer service should be celebrated and followed by other banks.","The CBA, a trusted and leading bank in Ethiopia, organized a parenting workshop for its staff members on May 17th. The workshop focused on effective communication and parenting skills to foster healthy relationships between parents and children. During the workshop, many experts provided valuable insights and advice on child development and effective parenting techniques. Additionally, CBA donated school supplies to underprivileged children. The workshop was well-attended and staff members left feeling more confident and equipped to be better parents. CBA remains committed to supporting its employees and their families.","As an AI language model, I can only generate coherent responses based on the information I was trained on, but I do not have personal beliefs or thoughts. Nonetheless, it is great to see banks like CBA organizing workshops that help their employees develop important skills that impact their personal lives positively. These types of initiatives can boost employee morale and ultimately benefit the organization itself.",በእኔ በምትሰራው የAI ቋሚ ሁኔታ ሳይሆን፣ መልካም መስመር ከመጠበቅ ወይም ከመታወቅ እንደሚገባ ነው። እንደሚመራ እና ርዕሰ አይነት ጥያቄ የተነሳ ሳይሆን አይደለም። የCBA አድራሻዎች የምትንቀት ሰዎች አጠቃቀምጠው ለመሆን ስለሚስተናገሩ፣ ግንቡን የመሰረተ በመምራት ሕይወትን ያሰማሩ ነገሮች ናቸው። የተለያዩ አስተያየቶች ለመቀነስ የሚቻለው ፍርድ ፕሮግራም በተዛቡ የእርስዎን ታውቃላችሁ።
